{
  "schemaVersion": "evergreen.rule.v1",
  "id": "android.target-sdk.existing.default-below-35",
  "ecosystem": "android",
  "purl": "pkg:generic/android/targetSdk",
  "affectedVersions": "vers:intdot/<35",
  "event": "end-of-support",
  "severity": "high",
  "title": "Google Play requires targetSdk 35+ for existing phone and tablet apps",
  "summary": "The Google Play target API level requirement page states, starting 2026-08-31: Existing apps must target Android 15 (API level 35) or higher to remain available to new users on devices running Android OS higher than your app's target API level. Apps that target Android 14 (API level 34) or lower, including Android 13 (API level 33) or lower for Wear OS, Android TV, and Android XR, and Android 12 (API level 31) or lower for Android Automotive OS, The same page says an extension to 2026-11-01 may be requested.",
  "replacement": "targetSdk 35 or higher (existing apps (availability to new users on newer OS versions); default (phone and tablet) apps)",
  "deadline": "2026-08-31",
  "sources": [
    {
      "title": "Meet Google Play's target API level requirement",
      "url": "https://developer.android.com/google/play/requirements/target-sdk",
      "accessedAt": "2026-10-30"
    }
  ],
  "provenance": {
    "observedAt": "2026-10-19",
    "reviewedAt": "2026-10-30",
    "reviewer": "arminazimi"
  },
  "migration": {
    "constraints": [
      "This floor applies to existing apps distributed on Google Play for default (phone and tablet) form factors; Wear OS, Android TV, Android XR, Android Automotive OS, and permanently private internal apps follow different Play requirements.",
      "Raising targetSdk can change platform behavior; read the Android 15 behavior-changes documentation before shipping."
    ],
    "steps": [
      {
        "id": "bump-target-sdk",
        "title": "Raise targetSdk to 35 or higher",
        "instructions": "Change the reported targetSdk in build.gradle(.kts) (or the version-catalog key or variable that supplies it) to 35 or higher.",
        "targets": "declaration"
      },
      {
        "id": "align-target-sdk-surfaces",
        "title": "Align other targetSdk declarations",
        "instructions": "Update every other module defaultConfig, product flavor, and version-catalog key that still pins a targetSdk below 35.",
        "targets": "all"
      }
    ],
    "verification": [
      {
        "command": "./gradlew assembleDebug",
        "purpose": "Build a debug APK with the raised targetSdk."
      }
    ]
  }
}
