{
  "schemaVersion": "evergreen.rule.v1",
  "id": "nodejs.symbol.timers.unrefactive",
  "ecosystem": "nodejs",
  "purl": "pkg:generic/nodejs",
  "affectedVersions": "vers:semver/>=24.0.0",
  "event": "removed",
  "severity": "high",
  "title": "Timers._unrefActive has been removed",
  "summary": "Node.js removed timers._unrefActive (DEP0127: runtime deprecation since v11.14.0, end-of-life since v24.0.0).",
  "replacement": "timeout.refresh(), or timeout.unref()",
  "sources": [
    {
      "title": "Node.js deprecations: DEP0127",
      "url": "https://nodejs.org/api/deprecations.html"
    }
  ],
  "provenance": {
    "observedAt": "2026-10-21",
    "reviewedAt": "2026-10-21",
    "reviewer": "arminazimi"
  },
  "migration": {
    "constraints": [
      "Keep the behavior of the code unchanged; check the replacement's argument and return-value differences."
    ],
    "steps": [
      {
        "id": "replace-symbol",
        "title": "Replace the usage",
        "instructions": "Replace each reported use of timers._unrefActive with timeout.refresh(), or timeout.unref().",
        "targets": "usages"
      }
    ],
    "verification": [
      {
        "command": "npm run test --if-present",
        "purpose": "Run the repository tests when defined."
      }
    ]
  }
}
