{
  "schemaVersion": "evergreen.rule.v1",
  "id": "nodejs.symbol.crypto.default-encoding",
  "ecosystem": "nodejs",
  "purl": "pkg:generic/nodejs",
  "affectedVersions": "vers:semver/>=20.0.0",
  "event": "removed",
  "severity": "high",
  "title": "Crypto.DEFAULT_ENCODING has been removed",
  "summary": "Node.js removed crypto.DEFAULT_ENCODING (DEP0091: runtime deprecation since v10.0.0, end-of-life since v20.0.0).",
  "sources": [
    {
      "title": "Node.js deprecations: DEP0091",
      "url": "https://nodejs.org/api/deprecations.html"
    }
  ],
  "provenance": {
    "observedAt": "2026-10-21",
    "reviewedAt": "2026-10-21",
    "reviewer": "arminazimi"
  },
  "migration": {
    "constraints": [
      "Keep the behavior of the code unchanged; check the replacement's argument and return-value differences."
    ],
    "steps": [
      {
        "id": "replace-symbol",
        "title": "Replace the usage",
        "instructions": "Replace each reported use of crypto.DEFAULT_ENCODING with code that no longer depends on it.",
        "targets": "usages"
      }
    ],
    "verification": [
      {
        "command": "npm run test --if-present",
        "purpose": "Run the repository tests when defined."
      }
    ]
  }
}
